PubmedID,Title,Publication Date,Non-academic Author(s),Company Affiliation(s),Corresponding Author Email
40644435,Examining COVID-19 vaccination coverage and acceptability among migrants in transit through Mexico during 2021-2022: Insights from shelter surveys and interviews.,2025,"Bojorquez-Chapela I, Aracena-Genao B, Leyva-Flores R, Cortes-Alcala R, Gomez-Lopez D, Allen C","Independent Researcher, Mexico City, Mexico., Ministry of Health (SSA), Mexico City, Mexico., El Colegio de la Frontera Norte, Ensenada, Baja California, Mexico.",N/A
40643934,Bis-Benzylisoquinoline Alkaloids Exhibit Inhibitory Properties Against Infectious Bronchitis Virus Infection In Vitro and In Ovo.,2025 Jun,"Jiang D, Zeng M, Yang W, Ding S, Jiang Y, Yuan Z, Huang G, Du X",These authors contributed equally.,yuanzhaoxia@163.com
40643361,Firefighter Perceptions of COVID-19 Mitigation Strategies and Messaging.,2025 Jul 11,"Hollerbach BS, Sutherland C, Hutchinson H, Koeppel MDH, Jahnke SA","NDRI-USA, Inc. 1920 W. 143 Street, Ste. 120, Leawood, Kansas 66224, USA.",N/A
40642769,"Surveillance of severe acute respiratory infections associated with SARS-CoV-2, influenza virus and RSV using ICD-10 codes: a case definition accuracy study across five European countries, 2021 to 2023.",2025 Jul,"Boere TM, Aspelund G, Lomholt FK, Lozano Alvarez M, Cauchi JP, Torres A, Seppala E, Marques DF, Veldhuijzen IK, Alves de Sousa L, Thordardottir M, Carvalho C, Rodrigues AP, Machado A, Boas H, Hooiveld M, Dziugyte A, Sanchez Ruiz MA, Vestergaard LS, Monge S, Paulsen TH, Nunes B","Consortium for Biomedical Research on Infectious Diseases (CIBERINFEC), Madrid, Spain., Epiconcept, Paris, France., The members of the ESURE SARI group are listed under Collaborators., Infectious Disease Prevention and Control Unit (IDCU), Health Promotion and Disease Prevention, Msida, Malta., Consortium for Biomedical Research on Epidemiology and Public Health (CIBERESP), Madrid, Spain.",N/A
40642065,A consensus mathematical model of vaccine-induced antibody dynamics for multiple vaccine platforms and pathogens.,2025,"Ribeiro RM, McMahon B, Molina-Paris C, Wilding KM, Kubicek-Sutherland JZ, Perelson AS","Physical Chemistry and Applied Spectroscopy Group, Los Alamos National Laboratory, Los Alamos, NM, United States.",N/A
40640745,Early development and dynamics of nasopharyngeal microbiota in infants during the COVID-19 pandemic: a 2-year prospective birth cohort study.,2025 Jul 10,"Perez-Arguello A, Garcia-Beltran C, Lluansi A, Blanco-Fuertes M, Rigalos A, Diaz M, Brotons P, Ibanez L, Cisneros M, Munoz-Almagro C, Henares D","Centro de Investigacion Biomedica en Red de Diabetes y Enfermedades Metabolicas asociadas (CIBERDEM), Instituto de Salud Carlos III, Monforte de Lemos 3-5, Madrid, Spain., Consorcio de Investigacion Biomedica en Red de Epidemiologia y Salud Publica (CIBERESP), Instituto de Salud Carlos III, Monforte de Lemos 3-5, Madrid, Spain., Consorcio de Investigacion Biomedica en Red de Epidemiologia y Salud Publica (CIBERESP), Instituto de Salud Carlos III, Monforte de Lemos 3-5, Madrid, Spain. carmen.munoza@sjd.es.",carmen.munoza@sjd.es
40640492,Interplay of kidney function and anti-SARS-CoV-2 antibodies in COVID-19 mortality: a prospective cohort study.,2025 Jul 10,"Reimann P, Fraunberger P, Cadamuro J, Leiherer A, Mink S, Zitt E, Hitzl W, Saely CH, Frick M, Drexel H","Central Medical Laboratories, Carinagasse 41 3495, 6800, Feldkirch, AT, Austria. smink@mzl.at., Central Medical Laboratories, Carinagasse 41 3495, 6800, Feldkirch, AT, Austria.",smink@mzl.at
40640198,Immunogenicity and protective efficacy of an intranasal neuraminidase-based influenza vaccine with bacterial cell membrane-derived adjuvants.,2025 Jul 10,"Puente-Massaguer E, Singh M, Mallett CP, Yueh J, Krammer F, Bhavsar D, Zimmermann J, Vasilev K, Hoxie I","Inspirevax Inc., Kirkland, Quebec, Canada.",florian.krammer@mssm.edu
40640175,Author Correction: An RBD-Fc mucosal vaccine provides variant-proof protection against SARS-CoV-2 in mice and hamsters.,2025 Jul 10,"Fry EE, Duyvesteyn HME, Huo J, Yuan Y, Zhang MQ, Liu SL, Zhang Y, Guo R, Rao H, Sun J, Zhao J, Zhang Z, He X, Liang Y, Pan X, Stuart DI, Wu Y","Diamond Light Source Ltd, Harwell Science & Innovation Campus, Didcot, UK., Guangzhou National Laboratory, Bio-island, Guangzhou, China. zhaojincun@gird.cn.",panxy@wh.iov.cn
